{
  "generatedAt": "2026-07-01T08:00:00+10:00",
  "generatedAtHuman": "01 July 2026, 08:00 AEST",
  "trackers": {
    "pelosi": {
      "name": "Nancy Pelosi",
      "chamber": "House",
      "status": "Current",
      "trades": [
        {
          "id": "retained-trade-1",
          "filingId": "old-filing",
          "asset": "NVIDIA Corporation (NVDA)",
          "ticker": "NVDA",
          "type": "Purchase",
          "owner": "SP",
          "traded": "2026-06-01",
          "filed": "2026-06-15",
          "lag": "14 days",
          "lagDays": 14,
          "amount": "$1,001 - $15,000",
          "source": "Official House Periodic Transaction Report",
          "sourceUrl": "https://example.invalid/old-filing"
        }
      ],
      "portfolio": {"holdings": []},
      "sourceStatus": {"errors": []}
    }
  },
  "sourceStatus": {}
}
